{
  "build_drivers": [
    {
      "driver": "go-v1",
      "execution_policy": "manager-worker-v1",
      "language": "go",
      "operating_systems": [
        "macos"
      ]
    },
    {
      "driver": "go-repository-v1",
      "execution_policy": "manager-worker-v1",
      "language": "go",
      "operating_systems": [
        "macos"
      ]
    }
  ],
  "classes": [
    "core",
    "manager"
  ],
  "created_at": "2026-07-13T00:00:00Z",
  "implementation": "example-manager",
  "implementation_version": "1.0",
  "operating_systems": [
    "macos"
  ],
  "protocol_version": "1.0.0-rc.5",
  "result": "pass",
  "schema_version": 3,
  "suite_sha256": "sha256:0000000000000000000000000000000000000000000000000000000000000000"
}
